{"radius":1,"ppsq":64,"cells":[{"gx":4,"gy":4,"status":"queued","image":true},{"gx":5,"gy":4,"status":"queued","image":true},{"gx":6,"gy":4,"status":"queued","image":true},{"gx":4,"gy":5,"status":"queued","image":true},{"gx":6,"gy":5,"status":"queued","image":true},{"gx":4,"gy":6,"status":"queued","image":true},{"gx":5,"gy":6,"status":"queued","image":true},{"gx":6,"gy":6,"status":"queued","image":true}],"queue_len":8}